{
  "$schema": "https://dmarc4all.toppymicros.com/schemas/diagnosis-result-1.3.0.schema.json",
  "format": "dmarc4all-diagnosis",
  "schemaVersion": "1.3.0",
  "generatedAt": "2026-07-30T00:00:00.000Z",
  "domain": "example.com",
  "locale": "en",
  "scope": {
    "basis": "public_dns",
    "resolver": "Cloudflare",
    "externalReferenceChecks": {
      "enabled": false,
      "attemptedSources": []
    },
    "limitations": [
      "no_email_sent_or_received",
      "no_mailbox_or_server_access",
      "dkim_selectors_not_exhaustively_discoverable",
      "results_require_header_and_rua_confirmation"
    ]
  },
  "summary": {
    "scores": {
      "overall": 78,
      "spf": 85
    },
    "enforcementReadiness": {
      "schemaVersion": "1.0.0",
      "decision": "INSUFFICIENT_EVIDENCE",
      "status": "ready_for_quarantine",
      "level": "warn",
      "policy": "none",
      "checks": {
        "dmarcRecordPresent": true,
        "dmarcPolicyValid": true,
        "aggregateReportingConfigured": true,
        "spfUsable": true,
        "dkimConfirmed": true
      },
      "blockers": [],
      "warnings": [
        "SUBDOMAIN_COVERAGE_UNKNOWN",
        "NONEXISTENT_DOMAIN_POLICY_UNKNOWN"
      ],
      "reasons": [
        {
          "code": "RUA_VOLUME_INSUFFICIENT",
          "category": "insufficient",
          "evidence": ["rua.summary"],
          "detail": "Observed 0 messages; the configured product gate is 100."
        },
        {
          "code": "RUA_WINDOW_INSUFFICIENT",
          "category": "insufficient",
          "evidence": ["rua.timeRange"],
          "detail": "Observed 0 days; the configured product gate is 7."
        },
        {
          "code": "SUBDOMAIN_COVERAGE_UNKNOWN",
          "category": "warning",
          "evidence": ["dns.subdomains"],
          "detail": "Subdomain sending coverage was not supplied."
        },
        {
          "code": "NONEXISTENT_DOMAIN_POLICY_UNKNOWN",
          "category": "warning",
          "evidence": ["dns.dmarc"],
          "detail": "Nonexistent-domain handling was not supplied."
        }
      ],
      "decisionBlockers": [],
      "decisionWarnings": [
        {
          "code": "SUBDOMAIN_COVERAGE_UNKNOWN",
          "category": "warning",
          "evidence": ["dns.subdomains"],
          "detail": "Subdomain sending coverage was not supplied."
        },
        {
          "code": "NONEXISTENT_DOMAIN_POLICY_UNKNOWN",
          "category": "warning",
          "evidence": ["dns.dmarc"],
          "detail": "Nonexistent-domain handling was not supplied."
        }
      ],
      "evidence": {
        "totalMessages": 0,
        "alignedMessages": 0,
        "unalignedMessages": 0,
        "unknownMessages": 0,
        "observationDays": 0,
        "alignedRate": null,
        "unalignedRate": null,
        "unknownRate": null,
        "spfOnlyRate": null,
        "thresholds": {
          "minimumMessages": 100,
          "minimumObservationDays": 7,
          "minimumAlignedRate": 0.98,
          "maximumUnknownRate": 0.05,
          "maximumSpfOnlyRate": 0.2
        }
      }
    },
    "enforcementReadinessApplicable": true,
    "mailProfile": "mail_capable",
    "mailProvider": {
      "id": "m365",
      "name": "Microsoft 365",
      "confidence": "High",
      "signals": [
        "MX: protection.outlook.com"
      ]
    }
  },
  "authentication": {
    "schemaVersion": "0.1.0",
    "requestedPolicy": "none",
    "effectivePolicy": "none",
    "source": {
      "domain": "example.com",
      "recordName": "_dmarc.example.com",
      "record": "v=DMARC1; p=none; rua=mailto:dmarc@example.com",
      "discoveryPath": [
        "_dmarc.example.com"
      ],
      "classification": "valid",
      "method": "exact-domain",
      "policyTag": "p",
      "domainExistence": "existent",
      "legacyTags": []
    },
    "organizationalDomain": {
      "domain": "example.com",
      "method": "highest-policy-record",
      "discoveryPath": [
        "_dmarc.example.com",
        "_dmarc.com"
      ],
      "confidence": "high"
    },
    "findings": [],
    "confidence": "high",
    "standards": [
      "RFC 9989"
    ]
  },
  "observations": {
    "dmarc": {
      "record": "v=DMARC1; p=none; rua=mailto:dmarc@example.com",
      "policy": "none",
      "aggregateReportingConfigured": true
    },
    "spf": {
      "records": [
        "v=spf1 include:spf.protection.outlook.com ~all"
      ],
      "recordCount": 1,
      "dangerousAll": false
    },
    "dkim": {
      "selectors": [
        "selector1"
      ],
      "confirmedSelectors": [
        "selector1"
      ],
      "usesCname": true
    },
    "bimi": {
      "name": "",
      "record": "",
      "logoUrl": "",
      "evidenceDocumentUrl": ""
    },
    "mx": {
      "records": [
        "0 example-com.mail.protection.outlook.com."
      ]
    },
    "mtaSts": {
      "record": "",
      "tlsReportingRecord": ""
    },
    "caa": {
      "records": []
    },
    "dnssec": {
      "ds": [],
      "dnskey": []
    },
    "subdomains": {
      "scanEnabled": false,
      "found": []
    }
  },
  "priorities": [
    {
      "severity": "med",
      "title": "DMARC is p=none",
      "action": "Review reports and consider a staged move to quarantine or reject."
    }
  ],
  "remediation": [
    {
      "severity": "med",
      "title": "Next candidate: move DMARC toward quarantine",
      "summary": "Move only after aggregate reports and real message headers show low false positives.",
      "records": [
        {
          "label": "DMARC",
          "host": "_dmarc.example.com",
          "type": "TXT",
          "currentValue": "v=DMARC1; p=none; rua=mailto:dmarc@example.com",
          "suggestedValue": "v=DMARC1; p=quarantine; rua=mailto:dmarc@example.com",
          "copyText": "_dmarc.example.com. 3600 IN TXT \"v=DMARC1; p=quarantine; rua=mailto:dmarc@example.com\""
        }
      ],
      "verify": "dig +short TXT _dmarc.example.com",
      "rollback": "Restore the previous p=none record if you see false positives."
    }
  ],
  "evidence": {
    "dnsRecords": [
      {
        "name": "_dmarc.example.com",
        "type": "TXT",
        "ttl": 300,
        "value": "v=DMARC1; p=none; rua=mailto:dmarc@example.com"
      }
    ],
    "dmarcLookups": [
      {
        "domain": "example.com",
        "status": 0
      },
      {
        "domain": "com",
        "status": 0
      }
    ]
  },
  "errors": []
}
